{
  "alignment_documents": {
    "acceptance_doc": "docs/benchmarks/simplified-likelihood-exporter-acceptance-2026-03-09.md",
    "artifact_reference_doc": "docs/references/simplified-likelihood-artifacts.md",
    "boundary_doc": "docs/benchmarks/simplified-likelihood-exporter-stable-source-semantics-boundary-2026-03-09.md",
    "cli_doc": "docs/references/cli.md",
    "example_path": "docs/specs/benchmarks/simplified_likelihood_exporter_stable_source_semantics_boundary_v0.example.json",
    "promotion_runbook_doc": "docs/benchmarks/simplified-likelihood-exporter-promotion-runbook-2026-03-09.md",
    "python_api_doc": "docs/references/python-api.md",
    "release_notes_doc": "docs/benchmarks/simplified-likelihood-release-notes-2026-03-08.md",
    "runtime_gate_doc": "docs/benchmarks/simplified-likelihood-exporter-runtime-gate.md",
    "rust_api_doc": "docs/references/rust-api.md",
    "schema_path": "docs/schemas/benchmarks/simplified_likelihood_exporter_stable_source_semantics_boundary_v0.schema.json",
    "server_api_doc": "docs/references/server-api.md",
    "stable_review_checklist_doc": "docs/benchmarks/simplified-likelihood-exporter-stable-review-checklist-2026-03-09.md",
    "support_matrix_doc": "docs/benchmarks/simplified-likelihood-support-matrix-2026-03-08.md"
  },
  "automatic_stable_promotion": false,
  "bundle_dir": "benchmarks/artifacts/simplified_likelihood_exporter_promotion_bundles/nextstat-bench/accepted",
  "future_stable_boundary": {
    "canonical_claims": [
      "future stable exporter claim remains pyhf-only on the source side",
      "future stable exporter claim remains single-POI only",
      "future stable exporter claim only promises constraint_covariance_source=source_model_constraints",
      "future stable exporter claim only covers Gaussian-constrained source nuisances on that path",
      "derived artifacts remain reduced-coordinate models rather than source-level nuisance replicas",
      "ranking and impact views on derived artifacts are not a source-level breakdown"
    ],
    "poi_scope": "single_poi",
    "ranking_source_level_breakdown_supported": false,
    "required_output_source_format": "derived_from_workspace",
    "requires_explicit_provenance": true,
    "requires_partial_bin_selection_reject": true,
    "source_level_nuisance_identity_preserved": false,
    "source_workspace_formats": [
      "pyhf"
    ],
    "supported_constraint_covariance_source": "source_model_constraints",
    "supported_source_constraint_families": [
      "gaussian"
    ]
  },
  "generated_at_utc": "2026-03-11T19:28:40Z",
  "research_grade_only_or_rejected": [
    {
      "detail": "constraint_covariance_source=aligned_fit_covariance remains available as a compatibility fallback, but it is outside the future stable exporter claim",
      "id": "aligned_fit_covariance",
      "status": "research-grade-only"
    },
    {
      "detail": "the future stable exporter claim does not promise non-Gaussian or unconstrained source nuisances on the source_model_constraints path",
      "id": "non_gaussian_or_unconstrained_source_nuisances",
      "status": "explicit_reject_or_research-grade-only"
    },
    {
      "detail": "partial per-channel bin selections stay rejected explicitly instead of silently dropping source-model semantics",
      "id": "partial_per_channel_bin_selection",
      "status": "explicit_reject"
    },
    {
      "detail": "multi-POI reduced export remains outside the future stable exporter claim",
      "id": "multi_poi_export",
      "status": "explicit_reject_or_out_of_scope"
    },
    {
      "detail": "derived reduced artifacts do not preserve original nuisance identities through reduction",
      "id": "source_level_nuisance_identity_preservation",
      "status": "not_promised"
    },
    {
      "detail": "ranking and impact outputs on derived reduced artifacts remain reduced-coordinate diagnostics rather than source-level systematic breakdowns",
      "id": "source_level_ranking_breakdown",
      "status": "not_promised"
    }
  ],
  "schema_version": "nextstat_simplified_likelihood_exporter_stable_source_semantics_boundary_v0",
  "status": "published",
  "summary": {
    "alignment_document_count": 12,
    "automatic_stable_promotion": false,
    "blocker_resolution_supported": true,
    "next_action": "keep this narrow boundary aligned across docs and accepted artifacts, then take an explicit stable promotion decision separately",
    "status": "published"
  },
  "support_class": "research-grade",
  "surface": "simplified_likelihood_exporter",
  "target_support_class": "stable"
}
